{
    "format": 1,
    "display_name": "Close Quarters",
    "icon_frame": "stage_close_quarters",
    "sound":
    {
        "sound_bank_name": "paint_exe",
        "music_name": "music.close_quarters",
        "music_volume": 0.65,
        "end_sting_name": "music.end_sting.close_quarters",
        "end_sting_volume": 0.65
    },
    "spawn_locations":
    {
        "team_a":
        [
            {
                "x": 30.0,
                "y": 4880.0
            },
            {
                "x": 120.0,
                "y": 4880.0
            },
            {
                "x": 210.0,
                "y": 4880.0
            },
            {
                "x": 300.0,
                "y": 4880.0
            }
        ],
        "team_b":
        [
            {
                "x": 5918.0,
                "y": 4880.0
            },
            {
                "x": 5828.0,
                "y": 4880.0
            },
            {
                "x": 5738.0,
                "y": 4880.0
            },
            {
                "x": 5648.0,
                "y": 4880.0
            }
        ]
    },
    "level_bounds":
    {
        "out_of_bounds":
        {
            "x": -100.0,
            "y": -100.0,
            "width": 6200.0,
            "height": 6200.0
        },
        "camera_bounds":
        {
            "x": -50.0,
            "y": 4300.0,
            "width": 6100.0,
            "height": 1050.0
        },
        "zoom_out_start_bounds":
        {
            "x": 0.0,
            "y": 4300.0,
            "width": 1920.0,
            "height": 1080.0
        },
        "zoom_out_finish_bounds":
        {
            "x": 0.0,
            "y": 4300.0,
            "width": 6000.0,
            "height": 1050.0
        }
    },
    "collision_objects":
    [
        {
            "name": "boundary_wall_left",
            "type": "Structure",
            "material": "ground",
            "sheet_name": "sprite_sheet_1",
            "frame_name": "square_white_4",
            "rectangle":
            {
                "x": -100.0,
                "y": 0.0,
                "width": 100.0,
                "height": 7000.0
            },
            "collision_type": "STRUCTURE",
            "colour": "808080"
        },
        {
            "name": "boundary_ceiling",
            "type": "Structure",
            "material": "ground",
            "sheet_name": "sprite_sheet_1",
            "frame_name": "square_white_4",
            "rectangle":
            {
                "x": -100.0,
                "y": -100.0,
                "width": 6200.0,
                "height": 100.0
            },
            "collision_type": "STRUCTURE",
            "colour": "808080"
        },
        {
            "name": "boundary_wall_right",
            "type": "Structure",
            "material": "ground",
            "sheet_name": "sprite_sheet_1",
            "frame_name": "square_white_4",
            "rectangle":
            {
                "x": 6000.0,
                "y": 0.0,
                "width": 100.0,
                "height": 7000.0
            },
            "collision_type": "STRUCTURE",
            "colour": "808080"
        },
        {
            "name": "boundary_floor_left",
            "type": "Structure",
            "material": "ground",
            "sheet_name": "sprite_sheet_1",
            "frame_name": "square_white_4",
            "rectangle":
            {
                "x": 0.0,
                "y": 5250.0,
                "width": 1500.0,
                "height": 1000.0
            },
            "collision_type": "STRUCTURE",
            "colour": "808080"
        },
        {
            "name": "boundary_floor",
            "type": "StructurePaintable",
            "material": "ground",
            "sheet_name": "sprite_sheet_1",
            "frame_name": "square_white_4",
            "rectangle":
            {
                "x": 1500.0,
                "y": 5250.0,
                "width": 3000.0,
                "height": 1000.0
            },
            "collision_type": "STRUCTURE_PAINTABLE",
            "colour": "GAINSBORO",
            "paintable_faces":
            {
                "left": false,
                "top": true,
                "right": false,
                "bottom": false
            }
        },
        {
            "name": "boundary_floor_right",
            "type": "Structure",
            "material": "ground",
            "sheet_name": "sprite_sheet_1",
            "frame_name": "square_white_4",
            "rectangle":
            {
                "x": 4500.0,
                "y": 5250.0,
                "width": 1500.0,
                "height": 1000.0
            },
            "collision_type": "STRUCTURE",
            "colour": "808080"
        },
        {
            "name": "spawn_a_floor",
            "type": "Structure",
            "material": "ruler",
            "sheet_name": "sprite_sheet_1",
            "frame_name": "square_white_4",
            "rectangle":
            {
                "x": 0.0,
                "y": 5000.0,
                "width": 850.0,
                "height": 10.0
            },
            "collision_type": "STRUCTURE_JUMP_THROUGH",
            "colour": "A0A0A0"
        },
        {
            "name": "spawn_b_floor",
            "type": "Structure",
            "material": "ruler",
            "sheet_name": "sprite_sheet_1",
            "frame_name": "square_white_4",
            "rectangle":
            {
                "x": 5150.0,
                "y": 5000.0,
                "width": 850.0,
                "height": 10.0
            },
            "collision_type": "STRUCTURE_JUMP_THROUGH",
            "colour": "A0A0A0"
        },
        {
            "name": "spawn_a_roof",
            "type": "Structure",
            "material": "ground",
            "sheet_name": "sprite_sheet_1",
            "frame_name": "square_white_4",
            "rectangle":
            {
                "x": 0.0,
                "y": 4700.0,
                "width": 400.0,
                "height": 40.0
            },
            "collision_type": "STRUCTURE",
            "colour": "808080"
        },
        {
            "name": "spawn_b_roof",
            "type": "Structure",
            "material": "ground",
            "sheet_name": "sprite_sheet_1",
            "frame_name": "square_white_4",
            "rectangle":
            {
                "x": 5600.0,
                "y": 4700.0,
                "width": 400.0,
                "height": 40.0
            },
            "collision_type": "STRUCTURE",
            "colour": "808080"
        },
        {
            "name": "spawn_a_baffle",
            "type": "Structure",
            "material": "ground",
            "sheet_name": "sprite_sheet_1",
            "frame_name": "square_white_4",
            "rectangle":
            {
                "x": 850.0,
                "y": 4740.0,
                "width": 100.0,
                "height": 300.0
            },
            "collision_type": "STRUCTURE",
            "colour": "808080"
        },
        {
            "name": "spawn_b_baffle",
            "type": "Structure",
            "material": "ground",
            "sheet_name": "sprite_sheet_1",
            "frame_name": "square_white_4",
            "rectangle":
            {
                "x": 5050.0,
                "y": 4740.0,
                "width": 100.0,
                "height": 300.0
            },
            "collision_type": "STRUCTURE",
            "colour": "808080"
        },
        {
            "name": "spawn_a_inner_step",
            "type": "Structure",
            "material": "ruler",
            "sheet_name": "sprite_sheet_1",
            "frame_name": "square_white_4",
            "rectangle":
            {
                "x": 650.0,
                "y": 4860.0,
                "width": 200.0,
                "height": 10.0
            },
            "collision_type": "STRUCTURE_JUMP_THROUGH",
            "colour": "A0A0A0"
        },
        {
            "name": "spawn_b_inner_step",
            "type": "Structure",
            "material": "ruler",
            "sheet_name": "sprite_sheet_1",
            "frame_name": "square_white_4",
            "rectangle":
            {
                "x": 5150.0,
                "y": 4860.0,
                "width": 200.0,
                "height": 10.0
            },
            "collision_type": "STRUCTURE_JUMP_THROUGH",
            "colour": "A0A0A0"
        },
        {
            "name": "spawn_a_outer_step",
            "type": "Structure",
            "material": "ruler",
            "sheet_name": "sprite_sheet_1",
            "frame_name": "square_white_4",
            "rectangle":
            {
                "x": 950.0,
                "y": 4860.0,
                "width": 200.0,
                "height": 10.0
            },
            "collision_type": "STRUCTURE_JUMP_THROUGH",
            "colour": "A0A0A0"
        },
        {
            "name": "spawn_b_outer_step",
            "type": "Structure",
            "material": "ruler",
            "sheet_name": "sprite_sheet_1",
            "frame_name": "square_white_4",
            "rectangle":
            {
                "x": 4850.0,
                "y": 4860.0,
                "width": 200.0,
                "height": 10.0
            },
            "collision_type": "STRUCTURE_JUMP_THROUGH",
            "colour": "A0A0A0"
        },
        {
            "name": "spawn_a_recovery",
            "type": "Structure",
            "material": "ruler",
            "sheet_name": "sprite_sheet_1",
            "frame_name": "square_white_4",
            "rectangle":
            {
                "x": 350.0,
                "y": 5140.0,
                "width": 300.0,
                "height": 10.0
            },
            "collision_type": "STRUCTURE_JUMP_THROUGH",
            "colour": "A0A0A0"